{
    "$schema": "http://json-schema.org/draft-07/schema#",
    "type": "object",
    "properties":
    {
        "$schema":
        {
            "type": "string"
        },
        "assets":
        {
            "type": "array",
            "description": "List of assets"
        },
        "includes":
        {
            "type": "array",
            "description": "Include extra assets json"
        },
        "map_script":
        {
            "type": "boolean",
            "description": "Is this a script for maps?"
        },
        "plugin":
        {
            "type": "boolean",
            "description": "Is this a plugin for servers?"
        },
        "name":
        {
            "type": "string",
            "description": "Name of the asset as-is"
        },
        "title":
        {
            "type": "string",
            "description": "Name"
        },
        "description":
        {
            "type": "string",
            "description": "Description for the header"
        },
        "metamod":
        {
            "type": "string",
            "enum": [
                "required",
                "optional",
                "no"
            ],
            "description": "Does this require metamod to some extent?"
        },
        "short_description":
        {
            "type": "string",
            "description": "Short description for the main table"
        },
        "details":
        {
            "type": "string",
            "description": "Path to a .html file in docs/ to add in the generated html"
        }
    },
    "additionalProperties": false,
    "required":
    [
        "name",
        "assets"
    ]
}
