{
    "$schema": "../../../schemas/assets.json",

    "assets":
    [
        "scripts/plugins/ShowPlayTime.as",
        "scripts/plugins/ShowPlayTime.json",
        "scripts/mikk155/meta_api.as",
        "scripts/mikk155/meta_api/json/v1.as",
        "scripts/mikk155/meta_api/json.as"
    ],

    "short_description": "Display the total time a map has been running on the server",

    "map_script": false,

    "plugin": true,

    "metamod": "optional",

    "name": "ShowPlayTime",

    "details": "angelscript/ShowPlayTime.html",

    "title": "Show map play time"
}
