{
    "$schema": "../../../schemas/assets.json",

    "assets":
    [
        "scripts/plugins/ChatRoles.as",
        "scripts/plugins/ChatRoles.json"
    ],

    "description": "Set custom roles and colors to player names in chat",

    "map_script": false,

    "plugin": true,

    "metamod": "optional",

    "name": "ChatRoles",

    "title": "Chat Roles"
}
