{
    "$schema": "../../../schemas/assets.json",

    "assets":
    [
        "scripts/plugins/ShowFrameRate.as"
    ],

    "short_description": "Allow players to see the server frame-rate information by a .framerate command",

    "map_script": false,

    "plugin": true,

    "metamod": "no",

    "name": "ShowFrameRate",

    "details": "angelscript/ShowFrameRate.html",

    "title": "Show server frame rate"
}
