{
    "$schema": "../../../schemas/assets.json",

    "assets":
    [
        "scripts/plugins/FastRestart.as",
        "scripts/plugins/FastRestart.json"
    ],

    "description": "Restart the map inmediatelly when a survival mode round is about to end.",

    "map_script": false,

    "plugin": true,

    "metamod": "optional",

    "name": "FastRestart",

    "title": "Survival Mode fast restart"
}
