{
    "$schema": "../../../schemas/assets.json",

    "assets":
    [
        "scripts/plugins/anticlip.as",
        "scripts/plugins/anticlip.json",
        "scripts/mikk155/meta_api.as",
        "scripts/mikk155/meta_api/json/v1.as",
        "scripts/mikk155/meta_api/json.as",
        "scripts/mikk155/Server/Framerate.as",
        "scripts/mikk155/Server/IsMapListed.as"
    ],

    "short_description": "Disable allied characters collision. Pass through players and allied monsters like in Left 4 dead",

    "map_script": false,

    "plugin": true,

    "metamod": "required",

    "name": "anticlip",

    "details": "angelscript/anticlip.html",

    "title": "Anti Clip"
}
