{
    "$schema": "../../../schemas/assets.json",

    "assets":
    [
        "scripts/plugins/BMLongJump.as",
        "scripts/plugins/BMLongJump.json"
    ],

    "short_description": "Double tap space to long jump. to any direction.",

    "map_script": false,

    "plugin": true,

    "metamod": "optional",

    "name": "BMLongJump",

    "title": "Black-Mesa Long jump module"
}
