{
    "$schema": "../../../schemas/assets.json",

    "assets":
    [
        "scripts/plugins/CustomPrecache.as",
        "scripts/plugins/CustomPrecache.json"
    ],

    "short_description": "Set a list of any type of asset to statically or dynamically precache across levels.",

    "details": "angelscript/CustomPrecache.html",

    "map_script": false,

    "plugin": true,

    "metamod": "optional",

    "name": "CustomPrecache",

    "title": "Custom Precache"
}
