{
    "$schema": "../../../schemas/assets.json",

    "assets":
    [
        "scripts/plugins/SurvivalLateJoinSpawn.as",
        "scripts/plugins/SurvivalLateJoinSpawn.json"
    ],

    "short_description": "Allow late join players to spawn for a first time if survival mode is been activated.",

    "map_script": false,

    "plugin": true,

    "metamod": "optional",

    "name": "SurvivalLateJoinSpawn",

    "details": "angelscript/SurvivalLateJoinSpawn.html",

    "title": "Survival Mode late join players respawn"
}
